{
  "schemaVersion": 1,
  "repo": "yukihito-jokyu/thread-atlas",
  "snapshot": "ba0e1938ed85973fbc14eed4303ddf3d14c9347c",
  "generatedAt": "2026-08-11T08:55:32.968Z",
  "tasks": {
    "L1": {
      "name": "MVP利用シナリオと成果物生成機能の扱いを確定する",
      "level": "L",
      "parentId": null,
      "taskType": "tracking",
      "dependency": "なし",
      "sourceHash": "c9eca467b7bef835240a3c3d07ef2bb17d113b85016a1486aa5b749f2231118f",
      "issueNumber": 3,
      "generatedHash": "a482ea2d92badbc280fa1a05141e5ca8d20774e8a00e77d2b6107f094241cc58"
    },
    "L1-M1": {
      "name": "壁打ちの開始・進行・認識修正・完了シナリオを定義する",
      "level": "M",
      "parentId": "L1",
      "taskType": "tracking",
      "dependency": "なし",
      "sourceHash": "a9d69113bcba7cbf32ff4de6316be40eaeb65b3fd0b85cf1abb81fa053cb23e6",
      "issueNumber": 10,
      "generatedHash": "a06acc1026df9eaf5183f54c59d15b74f31ff658ff25037d76272a75095ebe30"
    },
    "L1-M1-S1": {
      "name": "新規壁打ち開始シナリオを作成する",
      "level": "S",
      "parentId": "L1-M1",
      "taskType": "requirements",
      "dependency": "なし",
      "sourceHash": "dabd4f9047a1236551a70cc8d6d071cd44ded003cf74347251eecdf13c3acdbf",
      "issueNumber": 52,
      "generatedHash": "cda885a4cf0bd2edef0bae0240ded48662bc481e7cc6fde91c861af1057ca07d"
    },
    "L1-M1-S2": {
      "name": "一問一答による議論進行シナリオを作成する",
      "level": "S",
      "parentId": "L1-M1",
      "taskType": "requirements",
      "dependency": "完了・Merge: L1-M1-S1",
      "sourceHash": "cd0468d08a86d3333c89fdd99e71b4c9f7c189d7a425ee691b3caebc9474b979",
      "issueNumber": 53,
      "generatedHash": "ee9d1e4e6a22006afc1716c13981af4c6a71f5d3799a05c80e4680228c59df53"
    },
    "L1-M1-S3": {
      "name": "AI認識のユーザー修正シナリオを作成する",
      "level": "S",
      "parentId": "L1-M1",
      "taskType": "requirements",
      "dependency": "完了・Merge: L1-M1-S2",
      "sourceHash": "addd94f9e30fb95fed8e54b78fa5ed5adc54d8e78a9a1483a72ba60a1f82ea04",
      "issueNumber": 54,
      "generatedHash": "794cd026861031432e816708856ccd91543f6747a4b180d6663afe3fb7ef772b"
    },
    "L1-M1-S4": {
      "name": "論点の正常完了・親復帰シナリオを作成する",
      "level": "S",
      "parentId": "L1-M1",
      "taskType": "requirements",
      "dependency": "完了・Merge: L1-M1-S2",
      "sourceHash": "d26589b330db3eb1cac68cd593efcb9a06e76cb5110a60a59a7ad47b7d7e2c0b",
      "issueNumber": 55,
      "generatedHash": "567c5f2ddbdb21b6409d816a3a628eb2e6e720d8f1c89826226cce933ddced46"
    },
    "L1-M2": {
      "name": "新規提案の発見・ユーザー判断シナリオを定義する",
      "level": "M",
      "parentId": "L1",
      "taskType": "tracking",
      "dependency": "なし",
      "sourceHash": "96c31b212d9897724ec2880816ef07edd015588b1494a6462d1c0aaa3a22720b",
      "issueNumber": 11,
      "generatedHash": "06bf6bf22816ae9c488603a13d047b9fc0fd3a6148d4262d1fe264c15059bda1"
    },
    "L1-M2-S1": {
      "name": "AI新規提案の発見・スコープ識別シナリオを作成する",
      "level": "S",
      "parentId": "L1-M2",
      "taskType": "requirements",
      "dependency": "なし",
      "sourceHash": "e8f9b45eb551df5ce6a01bafa32cd53822b7299f4bfa878b78a5796781febbd3",
      "issueNumber": 56,
      "generatedHash": "bfb74531f6ab4b97d195e8b6c2ee0853741c8fb1bb27fa77dec8c4298f1a5e6d"
    },
    "L1-M2-S2": {
      "name": "新規提案への3判断と継続先シナリオを作成する",
      "level": "S",
      "parentId": "L1-M2",
      "taskType": "requirements",
      "dependency": "確定・Merge: L1-M2-S1",
      "sourceHash": "1a7ea95fd6495dde027d499c8f72fcd24c90935a9796315df18407dc1b28452d",
      "issueNumber": 57,
      "generatedHash": "56c7442265322f1e58bcc3163673c0d4d08564017863c60ff65c853652954954"
    },
    "L1-M3": {
      "name": "理解停止・背景再確認の利用場面と復帰分岐を定義する",
      "level": "M",
      "parentId": "L1",
      "taskType": "tracking",
      "dependency": "なし",
      "sourceHash": "e12a6a596d10abfce5b051605b1643c89a1de18eb7b0d1925e2861bb560ab7a5",
      "issueNumber": 12,
      "generatedHash": "19d3c6b4f5ca3009477a8a68efb0982208c6e8632f7fb41a5a2bc80393b5def1"
    },
    "L1-M3-S1": {
      "name": "理解停止の通知・次論点非進行シナリオを作成する",
      "level": "S",
      "parentId": "L1-M3",
      "taskType": "requirements",
      "dependency": "なし",
      "sourceHash": "9fe66bb1f4fc9bf1762638cd9b47f72a02d56206f8548b960535a238a2330ae1",
      "issueNumber": 58,
      "generatedHash": "bdf85d2762d91e871c924157613d42d83c2e7f8240c16c3986491b418ef04c38"
    },
    "L1-M3-S2": {
      "name": "背景再説明・理解未解消反復・通常進行復帰シナリオを作成する",
      "level": "S",
      "parentId": "L1-M3",
      "taskType": "requirements",
      "dependency": "確定・Merge: L1-M3-S1",
      "sourceHash": "a89713f742248f9a9ba957d564fe44c88169d1216f60c282957234ec805c30f8",
      "issueNumber": 59,
      "generatedHash": "04bb263bc7073185128f77b26db8af8739c562abf7e7ffda963c2acf4e1273d1"
    },
    "L1-M4": {
      "name": "議論の中断・経緯確認・再開シナリオを定義する",
      "level": "M",
      "parentId": "L1",
      "taskType": "tracking",
      "dependency": "なし",
      "sourceHash": "fd8d8f7bb23c2966dffbdc9ca97c96da8e6e719b1c0de2a81bc1fe98050e6c30",
      "issueNumber": 13,
      "generatedHash": "8e2afce164ef37f14ee9cd95b11ffac5aa01c4acfcc0916b81c4ea4a54f40d3b"
    },
    "L1-M4-S1": {
      "name": "下位議論の中断・親論点継続シナリオを作成する",
      "level": "S",
      "parentId": "L1-M4",
      "taskType": "requirements",
      "dependency": "なし",
      "sourceHash": "e277eab8ee60be24df756a26633c1fa2136cae7f5ce789890474d62037bacab6",
      "issueNumber": 60,
      "generatedHash": "a8a36eb84fe02dc47bde6341d29388c4d0e5dc80523fbceea40df1754c4098bb"
    },
    "L1-M4-S2": {
      "name": "中断論点の経緯確認・再訪シナリオを作成する",
      "level": "S",
      "parentId": "L1-M4",
      "taskType": "requirements",
      "dependency": "確定・Merge: L1-M4-S1",
      "sourceHash": "7c2f7e1b51f1b6f7eae6c2ecc59ca84a3ee4603c4b7b91fb294153f0b9bd6562",
      "issueNumber": 61,
      "generatedHash": "f96479b26b85d655090d592c1a7de10d319f51ae28c420a56f8a4f8aa1d8cfde"
    },
    "L1-M4-S3": {
      "name": "アプリ終了後のセッション復元・再開シナリオを作成する",
      "level": "S",
      "parentId": "L1-M4",
      "taskType": "requirements",
      "dependency": "なし",
      "sourceHash": "c0b944cae0c6e9536f11891bd6a6e71e20882d4e3a44967e56d8c736f954a824",
      "issueNumber": 62,
      "generatedHash": "daffa8a31a4fc7b4453c2f52d9346cc3e49328343667e700c0a486c9d907e54a"
    },
    "L1-M5": {
      "name": "L1シナリオ被覆と成果物生成機能のMVP／将来境界を確定する",
      "level": "M",
      "parentId": "L1",
      "taskType": "tracking",
      "dependency": "完了・Merge: L1-M1、L1-M2、L1-M3、L1-M4",
      "sourceHash": "c733983fbd48d899c9f1d68dd49fe95130e5eec491833751da6507ead5240632",
      "issueNumber": 14,
      "generatedHash": "18bf6513f6ea51693284c6b098ae3cceed912cfe5d15348d228c83c0c9d51fbe"
    },
    "L1-M5-S1": {
      "name": "L1シナリオ・FR・MVP被覆／Owner割当表を確定する",
      "level": "S",
      "parentId": "L1-M5",
      "taskType": "requirements",
      "dependency": "完了・Merge: L1-M1、L1-M2、L1-M3、L1-M4",
      "sourceHash": "18be629e147f67cfeac6d877a85315b53b74925980f9c7c3bdd85fe3596bdf68",
      "issueNumber": 63,
      "generatedHash": "a956887561d9ef23e4d86afb5adcd4dec6597418da87fac4169fae62ed7623a4"
    },
    "L1-M5-S2": {
      "name": "成果物生成機能のMVP外・将来Issue境界を確定する",
      "level": "S",
      "parentId": "L1-M5",
      "taskType": "requirements",
      "dependency": "なし",
      "sourceHash": "872495f936f64069a7e5b0e8e90a4f42625d8084215c27ad3ed3f4b0890af324",
      "issueNumber": 64,
      "generatedHash": "1cd88dffa2350b84c2edc782f6504ebea3e4b8bc4333fac23e6cf2f933b5f684"
    },
    "L2": {
      "name": "論点ライフサイクルと終了・復帰規則を確定する",
      "level": "L",
      "parentId": null,
      "taskType": "tracking",
      "dependency": "なし",
      "sourceHash": "01c21d99db1913ef9d8209591e3e648c9fa26abdba647d31fa40b7c92df1049b",
      "issueNumber": 4,
      "generatedHash": "20070e06583e369187a854d3ceac1ec5d11396adef7c2ef681ff4c4bbb9bb6bf"
    },
    "L2-M1": {
      "name": "論点状態語彙と状態軸の関係を確定する",
      "level": "M",
      "parentId": "L2",
      "taskType": "tracking",
      "dependency": "なし",
      "sourceHash": "2a70ee2ffe0803ff3777b2c0aa47b7f427b8fe53aa5ea7b4893fa8fe7740e431",
      "issueNumber": 15,
      "generatedHash": "ccec7e5081fc92f537c2735cc22d22f4086f407f390a4825624e629a2580a70b"
    },
    "L2-M1-S1": {
      "name": "§10の7状態語彙の意味・適用境界を定義する",
      "level": "S",
      "parentId": "L2-M1",
      "taskType": "requirements",
      "dependency": "なし",
      "sourceHash": "f86fe349cd8868cc4d98512f8f0a6f23bc5963fd09f587dec73a525f77b970b7",
      "issueNumber": 65,
      "generatedHash": "55e2729bde9992a5d9dbfec7fc4f70d9f54b6a388e328fceff99a8b795db7a5f"
    },
    "L2-M1-S2": {
      "name": "状態軸モデルと7状態語彙の配置を確定する",
      "level": "S",
      "parentId": "L2-M1",
      "taskType": "requirements",
      "dependency": "完了・Merge: L2-M1-S1",
      "sourceHash": "ba3744c373533e736a374db9d592cbed99bc39d83c9c8736b0ccff79077475aa",
      "issueNumber": 66,
      "generatedHash": "efd5fd34f9b7766cbfd5671d7751f53347ef11a6a693afda4b8cbf416b60b262"
    },
    "L2-M1-S3": {
      "name": "状態組合せ制約と決定済み／論点完了の関係を確定する",
      "level": "S",
      "parentId": "L2-M1",
      "taskType": "requirements",
      "dependency": "完了・Merge: L2-M1-S2",
      "sourceHash": "5a2dd48f19eb41cb6f7a0dc2235f032767faad44b012b557e78de27488987a2b",
      "issueNumber": 67,
      "generatedHash": "edd5a1f90327f0b373b908e9014daf37d5d719b8173a474ba478e660917b7f96"
    },
    "L2-M2": {
      "name": "完了条件の生成・変更・充足判定規則を確定する",
      "level": "M",
      "parentId": "L2",
      "taskType": "tracking",
      "dependency": "完了・Merge: L2-M1",
      "sourceHash": "0779e405bad4b0b1112f5c1030e6f63e7b02fdbadea62cf74537e387af0bdf39",
      "issueNumber": 16,
      "generatedHash": "6eb661143c7ce0e7a5738f9ba07d9f5af3b509d17f3f88212faf32e0b7a1bc2d"
    },
    "L2-M2-S1": {
      "name": "完了条件の意味上の入力・初期設定規則を確定する",
      "level": "S",
      "parentId": "L2-M2",
      "taskType": "requirements",
      "dependency": "完了・Merge: L2-M1",
      "sourceHash": "77ce469eaea9cab33d5a857446fb9e0279d6aee119c5fd115468a2b2b5a65843",
      "issueNumber": 68,